{
  "contract": "ideia.artifact-metadata/1",
  "artifact_id": "art_123e4567-e89b-42d3-a456-426614174000",
  "task_id": "tsk_123e4567-e89b-42d3-a456-426614174000",
  "producer_call_id": "cal_123e4567-e89b-42d3-a456-426614174000",
  "kind": "default",
  "lifecycle": "staged",
  "reference": {
    "profile": "raw-sha256-v1",
    "digest": "sha256:0000000000000000000000000000000000000000000000000000000000000000",
    "size_bytes": 0,
    "media_type": "default"
  },
  "data_class": "D0",
  "redaction_status": "not_required",
  "retention_class": "default",
  "expires_at": "2024-01-01T00:00:00.000Z",
  "storage_profile": "per-artifact-no-dedup-v1",
  "created_at": "2024-01-01T00:00:00.000Z",
  "lifecycle_changed_at": "2024-01-01T00:00:00.000Z",
  "quarantine_reason_code": null,
  "metadata_fingerprint": "sha256:0000000000000000000000000000000000000000000000000000000000000000"
}
